{
  "object_type": "payment_authorization",
  "contract_version": "0.2.0",
  "created_at": "2026-08-06T13:02:00Z",
  "authorization_id": "ucp-payauth-0001",
  "amount": { "currency_code": "USD", "value": "49.95" },
  "payer_ref": { "ref_type": "principal", "id": "principal-ucp-wallet-001" },
  "payee_ref": { "ref_type": "merchant", "id": "merchant-ucp-001" },
  "requirement_ref": { "ref_type": "payment_requirement", "id": "ucp-preq-0001" },
  "one_time": true,
  "authorization_material": {
    "redacted": true,
    "material_class": "payment_credential",
    "method": "digest_only",
    "digest": {
      "algorithm": "sha-256",
      "encoding": "hex",
      "value": "3d3d3d3d3d3d3d3d3d3d3d3d3d3d3d3d3d3d3d3d3d3d3d3d3d3d3d3d3d3d3d3d"
    }
  },
  "native": {
    "protocol_family": "UCP",
    "protocol_version": "1.1",
    "native_object_type": "AuthorizationResponse",
    "digest": {
      "algorithm": "sha-256",
      "encoding": "hex",
      "value": "4e4e4e4e4e4e4e4e4e4e4e4e4e4e4e4e4e4e4e4e4e4e4e4e4e4e4e4e4e4e4e4e"
    },
    "custody": { "disposition": "caller_retained" },
    "captured_at": "2026-08-06T13:02:00Z"
  }
}
